{
  "schemaVersion": 1,
  "id": "es-ja",
  "from": "es",
  "to": "ja",
  "levels": [
    {
      "id": "es-ja-lv-1",
      "name": "Japonés de sillón",
      "units": [
        {
          "id": "es-ja-lv-1-un-1",
          "title": "De kana a primeras frases",
          "lessons": [
            {
              "id": "es-ja-lv-1-un-1-ls-1",
              "title": "Hiragana básico",
              "exercises": [
                {
                  "type": "KanaChoose",
                  "id": "es-ja-e1",
                  "kana": "�‚",
                  "romajiOptions": ["u", "a", "e"],
                  "correctRomaji": "a"
                },
                {
                  "type": "KanaChoose",
                  "id": "es-ja-e2",
                  "kana": "�„",
                  "romajiOptions": ["i", "e", "a"],
                  "correctRomaji": "i"
                },
                {
                  "type": "KanaChoose",
                  "id": "es-ja-e3",
                  "kana": "く",
                  "romajiOptions": ["ku", "nu", "me"],
                  "correctRomaji": "ku"
                },
                {
                  "type": "ListenChoose",
                  "id": "es-ja-e4",
                  "audioText": "�‚",
                  "options": ["�‚", "�„", "�†"],
                  "correctIndex": 0
                },
                {
                  "type": "MatchPairs",
                  "id": "es-ja-e5",
                  "pairs": [
                    {"left": "�‹", "right": "ka"},
                    {"left": "き", "right": "ki"}
                  ]
                },
                {
                  "type": "ListenType",
                  "id": "es-ja-e6",
                  "transcription": "�‚�„",
                  "audioText": "�‚�„"
                }
              ]
            },
            {
              "id": "es-ja-lv-1-un-1-ls-2",
              "title": "Kanji y partículas",
              "exercises": [
                {
                  "type": "KanjiReading",
                  "id": "es-ja-e7",
                  "kanji": "人",
                  "readingOptions": ["ひと", "�„ぬ", "ね�“"],
                  "correctReading": "ひと"
                },
                {
                  "type": "KanjiReading",
                  "id": "es-ja-e8",
                  "kanji": "�—�",
                  "readingOptions": ["にち", "ほ�‚“", "�‚†き"],
                  "correctReading": "にち"
                },
                {
                  "type": "ParticleFill",
                  "id": "es-ja-e9",
                  "sentenceTemplate": "�‚��Ÿ�—_�š社�“�で�™�€‚",
                  "particles": ["は", "�Œ", "�‚’"],
                  "correctParticle": "は"
                },
                {
                  "type": "ParticleFill",
                  "id": "es-ja-e10",
                  "sentenceTemplate": "�‚Š�‚“�”_�Ÿべま�™�€‚",
                  "particles": ["�‚’", "に", "�Œ"],
                  "correctParticle": "�‚’"
                },
                {
                  "type": "MatchPairs",
                  "id": "es-ja-e11",
                  "pairs": [
                    {"left": "なま�ˆ", "right": "nombre"},
                    {"left": "て�‚“き", "right": "clima"},
                    {"left": "�‚Š�‚“�”", "right": "manzana"}
                  ]
                },
                {
                  "type": "ListenType",
                  "id": "es-ja-e12",
                  "transcription": "は�„",
                  "audioText": "は�„"
                }
              ]
            }
          ]
        }
      ]
    }
  ]
}
